{
  "v": 2,
  "id": "01JB2Z8Y3K4M5N6P7Q8R9S0TVW",
  "type": "properties.update",
  "ts": 1761274800000,
  "payload": {
    "baseVersion": "e3b0c44298fc1c149afbf4c8996fb92427ae41e4649b934ca495991b7852b855",
    "changes": {
      "motd": "Welcome",
      "view-distance": 12,
      "pvp": false
    }
  }
}
